<?xml version="1.0" encoding="UTF-8"?>
<!ELEMENT CatalogoVOD (cuenta, contenido)>
<!ELEMENT cuenta (perfiles)>
<!ATTLIST cuenta correo CDATA #REQUIRED>
<!ELEMENT perfiles (perfil+)>
<!ELEMENT perfil (#PCDATA)>
<!ATTLIST perfil
    usuario ID #REQUIRED
    idioma (Spanish|English) #REQUIRED
>
<!ELEMENT contenido (peliculas, programas)>
<!ELEMENT peliculas (genero+)>
<!ELEMENT programas (genero+)>
<!ELEMENT genero (titulo+)>
<!ELEMENT titulo (#PCDATA)>
<!ATTLIST genero nombre CDATA #REQUIRED>
<!ATTLIST titulo duracion CDATA #REQUIRED>